{
  "schema_version": "1.0.0",
  "operation": "push_to_remote",
  "work_item_id": "sdlc-supervisor-testbed",
  "task_id": "F11.1",
  "target_branch": "master",
  "commit_sha": "78f3998bd993bbff9a3e3ccbd9693c6d2c7b7018",
  "approved_at": "2026-09-01T00:00:00Z",
  "approved_by": "mcfrench@gmail.com",
  "instruction": "Same live instruction as the accompanying merge_to_default_branch record: merge everything (sdlc-supervisor framework + both live-incident fixes) to master now, and push so the add-on's auto_update picks up the bumped version.",
  "single_use": true,
  "consumed": true,
  "consumed_at": "2026-09-01T00:06:00Z",
  "consumed_by": "supervisor-session-20260901-merge-favorites-two-column",
  "notes": "Action taken: `git push origin master` -> `e1552ab..78f3998  master -> master`, a clean fast-forward push, no force needed. origin/master now at 78f3998bd993bbff9a3e3ccbd9693c6d2c7b7018, matching this record's commit_sha."
}
